{
  "name": "Legolas",
  "controlled_by": "player2",
  "race": "Elf (Wood)",
  "class": "Ranger",
  "level": 3,
  "background": "Outlander",
  "alignment": "Chaotic Good",
  "experience_points": 900,
  "ability_scores": {
    "strength": 12,
    "dexterity": 17,
    "constitution": 14,
    "intelligence": 11,
    "wisdom": 15,
    "charisma": 10
  },
  "ability_modifiers": {
    "strength": 1,
    "dexterity": 3,
    "constitution": 2,
    "intelligence": 0,
    "wisdom": 2,
    "charisma": 0
  },
  "proficiency_bonus": 2,
  "skills": {
    "athletics": 3,
    "nature": 2,
    "perception": 6,
    "stealth": 5,
    "survival": 4
  },
  "hp": {
    "current": 24,
    "max": 24,
    "temp": 0
  },
  "armor_class": 15,
  "initiative": 3,
  "speed": 35,
  "hit_dice": {
    "total": 3,
    "remaining": 3
  },
  "death_saves": {
    "successes": 0,
    "failures": 0
  },
  "inventory": [
    {
      "name": "Quiver with 20 arrows",
      "quantity": 1,
      "weight": 1,
      "equipped": true
    },
    {
      "name": "Rope, hempen (50 feet)",
      "quantity": 1,
      "weight": 10,
      "equipped": false
    },
    {
      "name": "Rations (1 day)",
      "quantity": 7,
      "weight": 2,
      "equipped": false
    },
    {
      "name": "Waterskin",
      "quantity": 1,
      "weight": 5,
      "equipped": true
    }
  ],
  "weapons": [
    {
      "name": "Longbow",
      "attack_bonus": 5,
      "damage": "1d8+3",
      "damage_type": "piercing",
      "properties": ["ammunition (range 150/600)", "two-handed"],
      "equipped": true
    },
    {
      "name": "Shortsword",
      "attack_bonus": 5,
      "damage": "1d6+3",
      "damage_type": "piercing",
      "properties": ["finesse", "light"],
      "equipped": true
    }
  ],
  "armor": {
    "name": "Studded Leather",
    "ac_bonus": 13,
    "type": "light",
    "equipped": true
  },
  "spellcasting": {
    "ability": "wisdom",
    "spell_save_dc": 12,
    "spell_attack_bonus": 4,
    "spell_slots": {
      "1": {
        "max": 3,
        "remaining": 3
      }
    },
    "spells_known": [
      "hunter's-mark",
      "cure-wounds",
      "goodberry"
    ]
  },
  "features_and_traits": [
    {
      "name": "Favored Enemy: Undead",
      "description": "Advantage on Survival checks to track undead and on Intelligence checks to recall information about them."
    },
    {
      "name": "Natural Explorer: Forest",
      "description": "Difficult terrain doesn't slow your group's travel in forests. Your group can't become lost except by magical means."
    },
    {
      "name": "Fighting Style: Archery",
      "description": "+2 bonus to attack rolls with ranged weapons (already included)"
    },
    {
      "name": "Darkvision",
      "description": "You can see in dim light within 60 feet as if it were bright light, and in darkness as if it were dim light."
    },
    {
      "name": "Fey Ancestry",
      "description": "Advantage on saving throws against being charmed, and magic can't put you to sleep."
    }
  ],
  "personality_traits": "Keen eyes, rarely speaks unless necessary",
  "ideals": "Freedom - Live free in the wilds",
  "bonds": "My clan and the forest are my life",
  "flaws": "Distrusts civilized folk"
}
